title,doc
海上自衛隊,海上からの侵略に備え、海上交通の安全を守るのが海上自衛隊の本分である。その組織は機動部隊である自衛艦隊（護衛艦・航空機・潜水艦など）と、担当区域の海上防衛・後方支援を行う全国5個地方隊に分かれる。飛行飛行任務部隊。大型哨戒機、水上救難機、艦載ヘリコプターなど、海上自衛隊保有の飛行機やヘリコプターの搭乗員である。航空管制飛行場で無線やレーダーを用いて、周辺を飛行、離着陸する航空機の誘導を行う。航空機整備飛行機の機体、エンジンなどの整備を行う。航空機体、航空電子、航空武器、航空発動機、航空電気計器に分かれる。射撃護衛艦などで、ミサイルや砲を用いて各種目標に対する攻撃を実施。ミサイルや砲の整備や弾火薬の取扱も行う。航海・船務艦艇の艦橋で航海に関する業務を行ったり、レーダー、電波探知装置を用いて戦術活動を行う。電測最新のIT機器を使って情報を収集し、艦船の内外に配付する。艦船の頭脳的部署。情報情報資料の収集、処理及び情報の配付、秘密保全、映像技術及び関連機材の操作、整備を行う。具体的には写真やビデオを撮影したり、資料から情報を分析したりする。機関エンジン発動機等の運転、整備及び火災、浸水対処業務を行う。蒸気、ディーゼル、ガスタービンの区分がある。水雷護衛艦、潜水艦で魚雷及びソナー等水中検索武器を操作し、潜水艦の捜索、攻撃を行う。魚雷と水雷に分かれる。掃海機雷掃海艦艇等で機雷探知機、掃海具等を操作し、機雷の処分や調整、関連機材の整備を行う。艦船整備艦船そのものや艦船用電気機材、船用品等の修理、整備、補給に関する業務を行う。電子整備、電機に分かれる。衛生病院における医療や健康管理、身体検査を実施するとともに、潜水に関する調査、研究を行う。気象海洋気象、海洋観測、それらに基づく天気図類の作成を行い、海洋関係の情報伝達業務を行う。観測艦などで南極に観測へ行くこともある。法務訴訟、損害賠償、損失保障及び海難審判などに関する業務を行う。幹部自衛官向けの頭脳労働職。経理・補給旅費等の予算作成、資金調達、支払い、隊員の給与計算などの会計業務を行う。潜水アクアラングを使用した潜水を行い、機雷等爆発物の捜索、処理、船底調査等の水中業務を行う。施設国有財産についての管理運用や、施設機材、車両を用いての建設作業、道路工事、それらの関連機材の整備を行う。音楽6つの専従音楽隊があり、各種イベントや儀式などで演奏を行う。（取得可能な資格）飛行　　ジェットパイロット／ヘリコプターパイロット免許航空管制丙種陸上無線通信士、航空無線通信士、航空交通管制基礎試験合格証明書、航空交通管制技能証明書4種類航空機整備JIS溶接／ガス溶接技能者、一般毒物劇物取扱者、非破壊検査技術者、電気工事士、電気主任技術者、情報処理技術者、高圧ガス製造保安責任者、火薬類取扱保安責任者、大型運転免許、牽引免許、危険物取扱主任、フォークリフト免許射撃4級小型船舶操縦士、乙種危険物取扱責任者、乙種火薬類取扱責任者航海・船務4級海技士、玉掛け技能、クレーン操縦士、4級小型船舶操縦士機関1級／2級ボイラー技士、ボイラー整備士、公害防止管理者、機関4級海技士（内燃）、高圧ガス製造保安責任者（乙種機械）、冷凍機主任取扱者、電気工事士、高圧ガス取扱責任者水雷4級小型船舶操縦士、危険物取扱者、火薬類取扱保安責任者掃海機雷4級小型船舶操縦士、火薬類取扱責任者、フォークリフト免許、クレーン免許艦船整備特殊無線技士、第1級陸上特殊無線技士、第1級／第2級陸上無線技術士、工事担当者アナログ第1種、第2種電気工事士、第3種電気主任技術者、危険物乙種4類、第3種冷凍機、消防設備士乙種4類、2級ボイラー技士補給危険物乙種4類、大型特殊運転免許、フォークリフト荷役講習修了証衛生准看護師、看護師、保健師、救急救命士、臨床検査技師、診療放射線技師、理学療法士気象海洋気象予報士、測量士補経理ワープロ検定、2級／3級簿記検定潜水潜水士免許施設大型／大型特殊免許、建築士、測量士、ボイラー技士、電気主任技術者、電気工事士＊そのほかの業務に給養員、警務員、地上救難員、電計処理員などがあり、調理師免許、柔剣道段位、消防設備士、情報処理技術者などの資格が取得可能。
海事代理士,20トン以上の船は、船の所有者など権利関係を明確にする登記を公示しなければならない。この登記の手続きや、船の安全性を確かめる検査の申請などを依頼者に代わって行うのが海事代理士だ。国家資格で、海事代理士試験に合格しなければならない。受験資格に年齢、学歴の制限はなく、合格後は、ほとんどが海事代理士事務所を開く。
オークション会社で働く,絵画や版画、工芸品、宝石などを売りたい人と買いたい人を結ぶのがオークション。オークション会社がほぼ定期的に主催し、公開の場で競売による落札という方法がとられる。オークション会社は落札価格の10％ほどの手数料を得る。欧米では、サザビーズやクリスティーズといった老舗が知られているが、日本にも十数社の会社がある。
音響効果,撮影の後、撮影・編集済みのフィルムの、音を整えたり、あるいは音を付け加えたりして、映画を完成させる作業を行う。その作業に必要な効果音を、新しく作る。映画にとって音は非常に重要で、映画全体の質が効果音のリアリティと質に左右されることがある。現実にはない音、たとえば『ジュラシック・パーク』のティラノザウルスの鳴き声などを、いろいろな現実音を組み合わせたり、シンセサイザーで新しく作り出したりする。映画関係の専門学校を出て、助手から始めるのが一般的だが、録音部から音響効果の仕事に移る人もいる。
音響エンジニア,同じ楽器を演奏しても、その音は場所によって違った音色で届く。音の響き、つまり音響は、音楽の一部であり、すべての音楽は音響技術に支えられている。音響エンジニアは、音の響きに関して、さまざまな工学的な仕事を受け持つ。以前は、音響機器メーカーなどに勤めて、おもにアンプやスピーカーなどの再生装置の設計や開発にあたっていたが、コンサート会場の増加や、騒音問題などの影響で、仕事の範囲が広がっている。コンサートホールやライブハウス、スタジオなどの音響設計はもちろん、建物・部屋の防音や遮音、防振、空調の消音などの施工・管理、あるいは音響測定、音響システム設計、音響コンサルタントなど。大学や専門学校などで、音響工学を学ぶことが必要。また電子・電気回路、オーディオ技術の知識のほかに、最近では、コンピュータが音響技術の核になっているため、コンピュータの技術と知識の習得も不可欠になっている。音響機器メーカー、音響設計会社、建築設計施工会社、放送局、スタジオ、映像スタジオなどさまざまな職場があるが、音に対する鋭くて優秀な感覚を持っていることが条件となる。
音楽の権利関係に関わる仕事,音楽をビジネスとしてとらえたとき、権利関係を管理する仕事は欠かせない。権利関係のなかで基本となるのが作曲家、作詞家が持つ著作権で、彼らに代わってこの著作権を管理する会社を音楽出版社という。出版社という名がついているのは、音楽ビジネスにおける最初のマスメディアである楽譜を出版していた名残りで、実際に出版活動を行っているところはごく一部。
音楽タレント,人生の一時期だけポップミュージックシーンで活動する人のこと。アイドルを含む。大きなレコード会社からデビューするメジャーと、独立系の小さなレコード会社からデビューするインディーズの2種類があるが、基本的には大した違いはない。クラシック音楽家やスタジオミュージシャンや歌手には演奏能力や歌唱能力が求められるが、音楽タレントに求められるのは、まったく別の才能だ。その才能を説明するのはむずかしい。極端なことをいうと、日本のポップミュージックシーンでは、音痴でもデビューできて、ヒットすることもあるし、曲が書けなくても、顔が悪くても、身長が低くてスタイルが悪くて、性格が最悪でも、成功し、スターになれる場合もある。もちろん、歌がうまくて、顔がよくて、背が高くスタイルがよくて、性格もよいのだったらそれに越したことはないが、それだけでデビューできたり、スターになれるとは限らない。成功する基準が曖昧で、挑戦するにはリスクが高い仕事。ミュージシャンとか、アーティストなどとも自称する音楽タレントのなかで、音楽だけで生活する人は100人にも満たない。デビューする方法としては、オーディション、持ち込み、ライブで発掘される、などがある。持ち込みの99％はボツになる。声と曲とルックスが判断基準であり、演奏はそんなに重視されない。だが演奏が非常にうまければスタジオミュージシャンに転向できる可能性もある。運よく音楽タレントとして発掘されても、売れなければ、廃棄処分となる。デビューして、2年後ないし3年後に、生き延びるか、廃棄処分になるか、プロダクションから判断が下る。生き延びるか廃棄処分かの基準は、レコードの売り上げやライブ動員数。つまり人気があって、プロダクションやレコード会社に利益が出たかどうかで決まる。音楽タレントに必要なのは、音楽的才能のほかに、若者としての、ある種の輝きのようなものだ。「何が何でもスターになってやる」というハングリー精神、「小さいころから異常に人気があった」というような生まれながらのスター性、他人には真似のできない自分だけの世界を表現・パフォーマンスする独自性、などが「輝き」を生む。ほかにやることがないからバンドでもやるか、というような中途半端な動機で音楽タレントを目指しても絶対に成功しない。
お笑いタレント,観客を笑わせる仕事には、コメディアン、漫才、落語などさまざまなものがある。かつてそれらはかなり明確に分かれており、それぞれの人の拠って立つところでもあった。コメディアンは舞台であれ映画であれ喜劇を演じるのが主な仕事だし、漫才師はコンビを組んで数分間の掛け合いの芸を見せるのが仕事だった。その垣根が曖昧になっていったのはテレビの影響が大きい。キャラクターを求められて出演することは増えても、「芸」を見せる番組は減る一方。収入の面でもテレビに依存してない人は少数派だ。落語家が落語家でいられるのはまがりなりにも寄席という場があるからで、それ以外はお笑いタレントと総称されることが多くなった。今も昔も、どうやったらなれるかなどという質問がほとんど無意味な世界だが、かつては師匠に弟子入りをしてその道に入るのが一般的だった。現在はオーディションを目指す人が多く、大手プロダクションの養成コースも定着してきた。もちろんオーディションに合格しても、養成コースを優秀な成績で卒業しても、それで食べていける保証はまったくないのだが。
オプチカル技師,暗い画面からしだいに映像が現れてくるフェード・イン、逆に映像がしだいに暗くなるフェード・アウト、画面が静止するストップモーション、複数の映像を重ね合わせるオーバーラップ（ディゾルブ）、メインタイトルやスタッフクレジット、そういった特殊な光学処理を行う専門職。オーバーラップなどはコンピュータによるデジタル処理でも可能だが、それと区別して、オプチカル（光学）処理と呼ばれている。
MR（医薬情報担当者）,MRとはMedical Representativeの略称。医師に自社の薬の成分や使用方法、効能について説明をする。宣伝できない副効用や認可前の薬の情報など、カタログや医薬書には載っていない薬の情報を伝達する専門職だ。日本では薬の営業もかねるが、欧米ではMRは営業ではなく、医師に医療チームの一員として認識されている。一般的にMRは製薬メーカーで働く。
絵本作家,おもに子供を対象として、絵を通して物語を伝える。最近では大人の読者も増えている。絵と文章の両方を表現する人もいれば、絵と文章が別の場合もある。子供たちに楽しさと元気を与える仕事で、男性作家も少なくないが、とりわけ女性に人気が高い。絵本作家になるには、作品を出版社の編集部に持ち込むのが一般的。文学の芥川賞や直木賞のような新人の登竜門となる賞はないが、企業が後援するアマチュア向けの賞やコンテストはかなりあり、それらに応募するのもひとつの手。ただし、受賞しても必ずしも絵本作家として独立できる保証はない。絵本は長く売れ続けることが多く、1年間に1000冊ほど（2002年）が出版されており、市場はしっかりある。少子化の時代を迎えて、子供に手をかける親が増えることも予想され、よい絵本を求める傾向が強まるだろう。ボローニア・ブックフェアのように世界的なブックフェアもあり、国際的な領域を持っている。
エディトリアルデザイナー,表紙、目次、本文、グラビア写真といった、雑誌や書籍のレイアウトを行う。専門学校や美術大学でデザインについて学んだ後にデザイン事務所で働くことが多いが、必ずしもそういうケースばかりではない。また、実務経験を積んだ後に独立をする人も多い。雑誌、書籍の内容を正確に解釈し、どのように本という体裁に仕上げるかが腕の見せ所となる。デザイナーは人気商売でもあり、デザインができるだけでなく、クライアントとのコミュニケーション能力や一般常識などの総合的な能力が必要とされる。技術はもちろんのこと、感性を磨き続けることが重要であり、ふだんから自分なりの美意識を持って映画や本などに接することが大切である。
エディター（編集）,撮影済みフィルムを脚本にしたがって編集する。映画関係の専門学校を出て、助手から始める。これまではフィルムを実際に切ったりつないだりしていたが、現在はコンピュータの映像編集ソフトを使い、ビデオで行うのが一般的になった。日本ではフィルムのムダづかいを防ぐため、1つのシーンをカットごとに分けて撮影していくのが普通だ。つまり日本では、あらかじめ編集しながら撮影しているということになる。そのためか、編集は地味な仕事という印象もある。しかし、アメリカ映画では、1つのシーンを「マスターショット」として最初から最後まで通して撮影し、その後で、クローズアップなど、「ピックアップ」というショットを撮る。さらにショットによっては複数のカメラを使うこともある。マスターショットと膨大なピックアップショットを編集しなければならないので、エディターと呼ばれる編集マンのセンスと才能が映画全体の出来を左右する。アメリカ映画では、編集の仕事から映画監督に進出する人もいるし、監督が自ら編集を担当することもある。
絵付師,チャイナペインティング、すなわち陶磁器に意匠をほどこす絵付師のこと。絵心はもちろん、必要とされるデザインを正確に描き表していく技術が要求される。日本では窯元に入るか、大手の食器メーカーに就職する道があるが、食器メーカーでは近年、印刷による大量生産が主流になってきていて、需要が多いとはいえない。
エステティシャン,皮膚のトリートメントや脱毛、痩身、ネイルケア、メイクアップなど、髪以外の全身美容のプロフェッショナル。客の目的や年齢、体質、性格などにあったエステティックを行う。皮膚や化粧品に関する知識や技術は、つねにステップアップしていく必要がある。また癒しを求めて来る顧客も多く、悩みや愚痴を聞くことも少なくない。エステティシャンになるためには、専門学校に通ったり、通信教育を受けることが一般的。就職先にはエステサロン、美容室、ホテル、化粧品メーカー、スポーツジムなどがあるほか、独立してサロンを自営してもよい。日本では公的な資格はまだなく、認定資格に日本エステティック協会の認定エステティシャンがある。欧米では認知度やステイタスが高い資格が各種設けられており、こうした資格を取得できるエステティックの専門学校や大学も数多く存在する。
エクステリアデザイナー,建物の外観に関わるデザインをする。たとえば塀や門、玄関までのアプローチ、カーポート、フェンスといった、建物の外周にまつわるデザインを手掛けていく。客や設計・施工担当者のイメージからラフデザインを描き起こし、さまざまな素材・既製品を組み合わせ、ときにはハンドメイドもして、具体的な形にまとめていく。エクステリアのリフォームも請け負っており、需要は増えている。和風、洋風に対応でき、国内外のエクステリアの流行に敏感な感性が求められる。専門学校のエクステリア技術科などで学ぶのが一般的。就職先としては、住宅メーカー、エクステリアメーカー、設計事務所などがある。独立してフリーランスで活躍することも可能だ。
栄養士,学校や病院などで給食の栄養管理と栄養指導を担当する。児童や入院患者の状態に合わせて、必要カロリー、栄養素などを考慮して、1日1日の献立を決めるのが主な仕事。そのほか、養護施設や養護老人ホームなど福祉施設で働く人もいる。1回に100食以上の集団給食を行う施設では、栄養士を置くことが求められている。栄養士は法律にもとづいた資格で、大学の家政学科、生活科学科や栄養専門学校など栄養士養成施設を卒業すると、取得できる。すべて昼間部のみで、夜間部や通信教育はない。今日、肥満や糖尿病などの生活習慣病の増加で、栄養指導に求められる知識や技能は高度化・専門化してきている。そのため、より複雑で困難な栄養指導にあたる管理栄養士の制度がある。寝たきり老人の介護などに携わるには、福祉の知識や経験も必要。今後も食事と健康に関わる栄養士の仕事はさらに広がっていくだろう。
英字新聞記者,在日外国人の情報源として、また英語を学習したい日本人の教材としても読まれている英字新聞。取材や原稿を書くなどの作業は日本語の新聞記者と変わらないが、スタッフに外国人がおり、また日本語の本紙がある場合は、その記事を英訳することが主な仕事である。このほか外国通信社の記事の転載もする。
営業（優位性を売る）,「モノをつくって売る」にしても「サービスを考えて提供する」にしても、それをひとりで、あるいは「つくる人」と「売る人」のふたりで行っているケースはほとんどない。現実にはその間にさまざまなものが介在し、そこに仕事が発生している。たとえば大規模な食品メーカーが、つくった製品を直接消費者に売ることはない。
映画プロデューサー,映画におけるクリエイティブな実権は監督にあるが、制作費を集めたり、監督やスタッフを決めたり、実際上の制作の責任と実権をすべて負うのはプロデューサーである。さらに宣伝や上映する映画館の手配も行い、映画の成否のリスクも負うことが多い。映画がコケたら莫大な借金を背負うプロデューサーもいる。かつて撮影所システムが機能していたころは大手映画会社に属するサラリーマンプロデューサーしかいなかったが、今では個人でリスクを負って企画を立てる独立系の人のほうが多い。
映画俳優,かつて日本映画全盛のころは映画俳優という確固たる職業があったが、今は死語に等しい。つまり映画への出演だけで生活の糧を得ている日本の俳優はほとんどいない。テレビドラマに出たり、テレビCFに出たり、舞台に出たりしながら映画出演の機会をうかがうのが一般的だ。しかしなかには映画のスクリーンだけにモチベーションを持つ数少ない俳優たちもいる。映画全盛期のように撮影所システムが機能していれば、撮影所が抱える「新人」としてデビューすることができたが、今はそれも不可能。映画俳優を志す人は、新作のオーディションに応募するか、芸能プロダクションの門を叩くか、学生映画に出て注目されるか、そのくらいしか方法がない。女優の場合、映画に出してやるよ、といって近づいてくる悪い人が大勢いるので注意が必要。本当に映画に出演させるだけの実力のあるプロデューサーや監督は、自分でリスクを負わなければならないので、映画に出してやるよ、などとは決していわない。
映画配給,外国の映画の日本国内での上映権利を買いつける。買いつけた後は、上映する映画館を決め、宣伝する。外国の映画会社との交渉になるので、外国語の能力が問われる場合もある。一人前になると、カンヌやベニスなど、華やかな映画祭に参加することもある。必ずしも映画関係の学校を出る必要はなく、映画制作の知識も必要ではない。
映画宣伝,かつては制作・配給会社の中に宣伝部があった。だが最近では、映画だけを扱う宣伝会社が増えている。場合によっては企画の段階から映画制作に参加し、メイキングを制作したり、原作本の出版を出版社に依頼したり、映画の封切りに合わせ宣伝戦略を立てる。そういった仕事を個人で請け負うフリーの映画宣伝プロデューサーもいる。
映画字幕翻訳,海外の映画作品の台詞やナレーションに日本語の字幕をつける。人間が文字を読む速度は1秒間に4文字程度といわれている。そのためどんなに長い台詞でも限られた字数内で、正確かつわかりやすく翻訳しなくてはならない。そのため外国語だけではなく、日本語の文章力があることが重要である。またどんなに台詞が多い映画でも、基本的に1本1週間で仕上げるという。
