title,doc
シナリオライター,映画、テレビドラマ、舞台などの脚本を書く。映画なら映画と決めて、特定の分野でだけ活躍している人もいるが、最初は映画監督を目指していたがテレビの仕事をするようになった人、テレビドラマが話題となり映画に進出する人、などもいる。これらのなかで比較的に職業として成立しやすいテレビドラマのシナリオについていうと、自分の書きたいドラマを書けるということはかなり少なくなってきている。視聴率が重視されるのはもちろんだが、たとえば企画そのものより出演者のスケジュールが優先されるなど、制約は多い。報酬はキャリアと知名度によりかなり差がある。シナリオスクールに通ってプロのシナリオライターの講師に見出されたり、シナリオ募集コンテストで優勝するなどの正統的なデビューもあるが、テレビや映画の制作会社でさまざまな仕事をした後にシナリオを書き始める人のほうが一般的だという。
シナリオデベロッパー,シナリオを吟味して、実際に映画に使うシナリオに「開発」していく。日本では監督やプロデューサーが行うことが多いが、ハリウッドには専門家がいる。いずれにしても、物語、台詞、登場人物の人間性などに対する深い洞察力と批判力が不可欠。
漆器,漆工芸は東アジア独特のもので、日本では縄文後期にはすでに漆器が存在していたといわれている。奈良時代には蒔絵（まきえ）のもととなる技術が誕生し、さらに平安時代には遣唐使の廃止後、日本独自の技法が発達していった。安土桃山時代に入ると南蛮文化の到来により、欧風のモチーフを扱う作品も作られるようになった。漆器が海外に輸出されるようになったのも、このころのこと。
質屋,客の持ち物を担保として預かり、査定をして、その品物の価値に見合った金額を貸す。期限内に現金と利子が返却されれば品物を返却するが、実際にはそのまま買い取ることも多い。質屋を営業するには各都道府県の公安委員会から質屋の許可を得ることが必要。質屋が扱う質草（質屋に預ける品物）は、戦後はテレビや冷蔵庫といった家電製品が多かったが、近年ではブランド品や貴金属などの小型の高額商品の買い取りがほとんどとなっている。
詩人,昔から詩を書くことで生活していくのはほとんど無理だったが、今は特にむずかしい。基本的に、詩は象徴的なものだ。言葉のシンプルな組み合わせで、普遍的なものを象徴する。その国が近代化される過程には、戦争や内乱や恐慌など、必ず激動期があり、民族や社会に共通した悲しみや喜び、それにある特定の気分が生まれる。
司書,図書館で働く専門職。図書や雑誌の収集、整理、保存、貸し出しから情報サービスなど一切を担当する。司書資格は、大学、短大で図書館学を履修するか、文部科学大臣認可の大学の養成講座修了でとれる。しかし、図書館で働くには必ずしも司書資格が必要ではなく、個々の図書館の職員採用試験を受けて合格すればいい。そのため、一般には図書館で勤務している人を総称して司書と呼ぶことも多い。本が好きな人にとっては魅力的な職業だが、近年はいろいろな年齢層の図書館利用者が増えているので、その人たちの閲覧相談に親切に対応できる人柄も必要とされる。また、パソコンによる検索システムが普及しているので、パソコン使用は必須。
指揮者,管弦楽団や交響楽団を指揮する。音楽大学の指揮科で学ぶか、海外で個人教授を受ける。あるいは作曲を学んだ後に指揮者になるケースもある。指揮者を職業としている人は、日本中で10人にも満たないかもしれない。日本の交響楽団が外国人の有名な指揮者を招待してコンサートをすることも多いからだ。ひょっとしたら、総理大臣になるより、指揮者として成功するほうがむずかしいかもしれない。音楽と楽器に対する深い理解と敬意、作曲家の意図とアイデアに対する卓越した想像力、そして演奏家たちの才能を引き出すコミュニケーションスキルとカリスマ性、プロデューサーとしてオーケストラを率いる忍耐力と指導力、すべてを備えていなければ指揮者にはなれない。音楽を愛する人にとって、フルオーケストラの指揮は、永遠のあこがれである。
歯科技工士,歯科医師の指示に従い、義歯や矯正装置を作成、修理する専門技術者。2、3年間の養成学校を経て、国家試験に合格しなくてはならない。その後、歯科医院、総合病院、歯科技工所などに就職して働く。ほかにも、歯材メーカーで器材の開発や研究をする、養成機関で教えるといった選択肢もあり、歯科技工所を開設してフリーで働くことも可能だ。また日本の歯科技工士教育は世界でもトップクラスで、現地で基礎教育を行う必要がないので、日本人歯科技工士は海外でも重宝されているという。一般的にはまだ十分に認知されている職業とはいえない部分もあるが、これから本格的な高齢化社会に向けて、歯科技工士への需要は確実に増えていくものと思われる。
歯科衛生士・歯科助手,歯科衛生士は歯科治療において、器材やカルテの管理など歯科医師が診察を行う際の補助をしたり、歯石を取り除くなど虫歯や歯周病にならないための予防処置を行う。また、患者の口の健康を守るための指導も行っている。専門学校、短大で指定された教科を学び、国家試験に合格したのち個人の歯科医院や大学病院、保健所などで働くのが一般的。高齢化が進んでいる最近では、ホームヘルパーの資格を取得し、福祉施設や自宅で寝たきりの生活をしているお年寄りを訪ね、口の中の清掃や義歯の使い方を指導する歯科衛生士も増えている。直接の医療業務をすることはないが、歯科医師が治療を行うにあたってなくてはならない存在であり、需要も少なくない。また、歯科助手も歯科医師の治療補助を行うが、特に資格を持っている必要がない。そのため、歯科助手は歯垢の除去や歯科保健指導など、直接患者の口の中に手を入れる行為はできない。
歯科医師,さまざまな器具や薬品を使って、虫歯や歯周病の治療や歯列矯正など、歯に関わるすべての医療業務を行う。文部科学大臣に認定された6年制の大学を、正規の歯学課程を修めて卒業したうえで歯科医師国家試験に合格し、厚生労働大臣の免許を受けることが必要。その後、数年間の臨床研修を行い、自分の技術に自信が持てるようになってはじめて歯科医業を行う。近年では、単に歯を治療するだけにとどまらず、より歯を美しく見せたいという需要も増加しているなど、歯科治療を取り巻く環境は変わりつつある。また、その技術は日々進歩しており、つねに学習をしようという意欲が不可欠。現在、歯科医師は飽和状態になりつつあるが、信頼に足る歯科医師は多くはない。確かな技術と知識を持って、患者の気持ちになりながら治療を行えることが、歯科医師として成功する重要な要素である。
塩作り職人,1997年に塩の専売法が廃止され、誰でも自由に塩の製造・販売ができるようになった。健康ブームで塩にこだわりを持つ人が増え、ブランド数は全国で1500を超すといわれている。なかでも注目を浴びているのが、海水を天日にさらしたり、煮詰めたりして作った天然塩で、沖縄から北海道までの各地で特色のある塩が作られている。
シェフ,西洋料理のコック長のこと。シェフになるには、10代のうちからレストランの厨房で働くことが一番だ。調理師専門学校を卒業し、学校の紹介で勤務することもあるが、これぞと思うレストランに募集の有無を確認するのがよい。修業時代の給与は少ないのが一般的だが、独立し自分の店を持つオーナーシェフになれば、店の売り上げによって収入も多くなる。料理の腕はもちろんだが、その日の気候や客の好みにあわせた味加減をするなどの細かい気配りも必要。味がよく、店の雰囲気や気遣いがしっかりした店なら、客がついてくる。計画的にやっていけば、若くしてオーナーシェフになることも可能だ。また、最近はシェフを目指す女性も増えている。海外のレストランで働きたい場合でも、まず日本で基礎を学んでおかなければ雇ってもらえないだろう。
山岳救助隊員,険しい山岳をパトロールし、遭難者が出たときは救出にあたる。遭難者を背負って山を降りたり、ヘリコプターを使うこともある。全国には山岳救助の民間組織も多く存在するが、ほとんどは山岳に関係する職業につく人びとのボランティア組織だ。山岳救助を専門職にしたい場合、まず考えられるのは警察官になること。
猿の調教師,ニホンザルに芸を教え、ともに舞台に立ち、芸を披露する。テレビ番組やCMに出演したり、幼稚園や老人ホームなどの福祉施設を訪問し、公演を行うこともある。もちろん猿の日常の世話もするため、住み込みで働くというところも少なくはない。猿に芸を仕込むのは根気のいる作業である。だからこそ、猿が芸をできるようになり舞台で成功すると、非常にうれしいし、練習の成果を出すことができなければ悔しいという。
茶道家,茶道の流派には、裏千家系、表千家系、武者小路千家流のほか、奈良流、利休流、藪内流、肥後古流、織部流など数多くある。茶道は家元制度で成り立っている。茶道家は、流派に入門し、十数段階ある許状と呼ばれる免状を順次取得して道を究めていく。家元はこの許状を発行する権限を持っており、弟子から支払われる免状料が最大の収入源になる。
作曲家,テレビドラマやドキュメンタリー、映画のテーマソング、CFの音楽、またテレビゲームや、歌手に曲を作る。音楽理論の知識や理解が必要なので、音楽大学や専門学校などで専門の教育を受けることが必要。特にテレビゲームの音楽では、コンピュータを使って作曲した後で、MIDIという国際規格のデジタルデータとして納品できる能力が求められる。最近では、テレビゲーム以外でもコンピュータによる作曲が増えている。ただし、当然のことだが、コンピュータの技術と作曲の才能とは別なので、コンピュータが得意だからといって作曲家になれるわけではない。また、レコード会社や原盤制作会社（CD制作を請け負う会社）、それにプロダクションなどのプロデューサーやディレクターのなかには、音楽大学を出て、専門的な知識を持つ人が増えている。彼らが作曲をするケースも増えていて、プロとして作曲だけを行う人は減っているようだ。だが、インターネットやデジタル放送など、新しいメディアの影響もあって、優秀な作曲家の需要がなくなることはない。
作家,13歳から「作家になりたいんですが」と相談を受けたら、「作家は人に残された最後の職業で、本当になろうと思えばいつでもなれるので、とりあえず今はほかのことに目を向けたほうがいいですよ」とアドバイスすべきだろう。医師から作家になった人、教師から作家になった人、新聞記者から作家になった人、編集者から作家になった人、官僚から作家になった人、政治家から作家になった人、科学者から作家になった人、経営者から作家になった人、元犯罪者で服役の後で作家になった人、ギャンブラーから作家になった人、風俗嬢から作家になった人など、「作家への道」は作家の数だけバラエティがあるが、作家から政治家になった人がわずかにいるだけで、その逆はほとんどない。つまり作家から医師や教師になる人はほとんどいない。それは、作家が「一度なったらやめられないおいしい仕事」だからではなく、ほかに転身できない「最後の仕事」だからだ。服役囚でも、入院患者でも、死刑囚でも、亡命者でも、犯罪者でも、引きこもりでも、ホームレスでもできる仕事は作家しかない。作家の条件とはただ1つ、社会に対し、あるいは特定の誰かに対し、伝える必要と価値のある情報を持っているかどうかだ。伝える必要と価値のある情報を持っていて、もう残された生き方は作家しかない、そう思ったときに、作家になればいい。
作詞家,歌の詞を書く。自作自演の歌手が増えたために、需要は減っているように見えるが、テレビのドラマやアニメやCFのテーマソング、新しい童謡、校歌など、歌そのものの数はむしろ増えているので、その重要性は変わっていないという指摘もある。専門学校があるが、歌詞のフォーマットがあるわけではないので、学校を出ればプロの作詞家になれるということではない。メロディをイメージした詞を書いて、レコード会社や原盤制作会社のプロデューサーやディレクターに持ち込むという方法もある。だが、持ち込みで成功する人はきわめて少ない。
作業療法士,病院やリハビリテーションセンター、老人センター、福祉施設などで、いろいろな作業を通じて、患者が失った身体の機能と社会適応能力を回復していく。その「作業」とは、日常生活のなかの動きや園芸、陶芸、工芸、手芸など。日常生活では、食事をしたり、歯を磨いたり、掃除をしたりと、知らず知らずのうちに身体のいろいろな機能を使っている。花や木の世話をすることでは、腕だけでなく足腰の筋力がアップするし、粘土をこねて成形していくことで指や手を細かく動かせるようになっていく。患者の状態や目的に応じて作業を選び、精神面をケアしながら、リハビリテーションを進めていくのが作業療法士の役割である。普通の人にとっては簡単な作業でも、患者にはとても困難で、作業を投げ出すことも多い。決してあきらめずに、優しく対応できるなど、根気と優しさも必要な仕事だ。作業療法士になるためには、養成課程を持つ専門学校や短大などで3年間以上学び、国家試験を受ける。ただしこうした学校を志望する人は年々増えており、狭き門となっている。
左官,土、砂、藁、石灰などのさまざまな材料と水を用いて、壁や土間を作る職人。材料の進歩とともに仕事の内容も多様化している。職業訓練校で学び、工務店などに勤めるのが一般的だが、小規模な事業所が多く、家族経営のところも多い。壁の仕上がりは職人の腕によるところが大きいが、高い技術を持った職人は少なくなりつつあるのが現状である。
サウンドマン（録音技師）,映画撮影の際にダイアローグ・台詞を同時録音し、また周囲の音も録音する。そして、撮影後にアフレコ（アフターレコーディング）と呼ばれる台詞の再録音・整音を行う。最初は、ブームと呼ばれる長いポールの先についたマイクロフォンを、カメラのフレームに入らないギリギリの近さで、俳優に近づけて台詞を拾うという作業から始める。
裁判官,全国各地の裁判所で、民事、刑事、行政、家庭、少年などの訴訟事件を審査し、法律に基づいて判決を下し、国民の権利を守り法秩序を維持する。「すべて裁判官は、その良心に従い独立してその職権を行い、この憲法及び法律にのみ拘束される」と憲法で定められており、ほかのどんな国家機関からも干渉を受けない。法曹資格を取得後、判事補として10年間実務を積んだ後に、裁判官（判事）に任命される。現在約3100人の裁判官が全国の裁判所に勤務しており、うち800人強が判事補である（2003年度統計）。裁判官には厳正中立な法の番人であることが求められており、重い使命が課せられている。今後は裁判の迅速化、専門化に対応するため、特に繁忙な都市部の裁判所を中心に増強が求められている。
コーディネーター,展覧会やイベントの企画で、主催者の目的やテーマに応じて、出典作品や出席者などを選択・調整し、予算やスケジュールなど実務面全体を担当する。職業というより役割なので、資格は必要ないが、学芸員資格や海外の美術館、博物館でキュレーター（学芸専門職）の研修を受けておくと仕事の分野が広がる。フリーランスで催事ごとに契約して働くことが多い。
昆虫採集・飼育用品の制作販売,捕虫網や飼育ケース、エサなどを専門に製作する会社は全国に数社ある。ほとんどが大量生産用の工場を持っていて、製品をペットショップやホームセンターにおろしている。直接、昆虫と接する機会は少ないが、商品開発部などに配属されればつねに昆虫と関わることになるだろう。また、昆虫関連用品の専門店は、全国でも5、6店と少ない。
コンサートプロデューサー,歌手やミュージシャン、オーケストラなどの、ライブコンサート全体を管理し、準備から終了までのすべての責任を負う。コンサートの規模、内容、時期、場所などを考え、予算を出し、概要を決めることから始めて、舞台監督を選び、監督とともに音響、照明の業者・スタッフを決めて、コンサート実施に向けて準備を進める。コンサート制作会社に下働きのアルバイトとして入り、経験を積み上げ、才能が認められてプロデューサーになるというケースがもっとも多い。専門学校にもカリキュラムがあるが、コンサートプロデューサーになるためには、音楽の知識のほかに、何よりも、並はずれたコミュニケーションスキルと交渉力が不可欠である。海外のアーティストを扱う場合は語学も必要となる。
コレペティトゥア,オペラの練習時にピアノの伴奏を行うが（公演時にはオーケストラによる演奏が一般的）、その役割は伴奏だけでなく、オペラ歌手の教師役となり、歌い方や演劇の指導までを行う。音楽大学のピアノ科もしくは伴奏科を卒業し、オペラ団体に所属しながら修業を積むことが多く、指揮者が兼ねることもある。日本ではそれほど認知されていない職業であり、需要も多くはないため、コレペティトゥアとして生計を立てることができているのは一握り。
コピーライター,商品の広告の「キャッチフレーズ」を考える。コピーは、もともとはその商品のことに詳しい売り主、つまりスポンサーが考えるものだった。だが時代とともにそれは広告代理店に外注されるようになり、広告代理店も制作会社に外注するようになっていった。こうした過程で、広告のコピーをつくることを専門とするコピーライターが生まれていった。フリーランスのイメージが強いが、今でも広告代理店や制作会社に所属するコピーライターのほうが数としては多い。80年代の一時期、何人かのスターコピーライターが出現して、職業として非常にもてはやされたこともあったが、企業の宣伝費の抑制傾向とともにそれも落ち着き、現在では広告制作という共同作業の一端を担う技術職、と位置づけられている。だが宣伝をする限りコピーは必要であり、優秀な人材は常に求められている。すぐコピーを書く仕事を与えられるかどうかはともかく、広告代理店や制作会社に入るなどして、制作の現場を知ることから始めるのが一般的だ。
骨董屋（こっとうや）,主に日本や中国、韓国などの骨董品を扱う。何よりも大切なのは、年代物の絵画、陶器、家具などを識別できる能力だ。これはにわか勉強では身につかないので、店主から時間をかけて学び、目利きとなる。はじめは店番をすることが多いので、基本的な接客マナーを持っていなければならない。経験を積むと、骨董品を売りに来る客と交渉し、買い取りの値段を決める仕事をまかされる。
国連職員,国連事務局には1万4000人が、ユニセフのような国連の下部機関やユネスコのような専門機関をすべて含めた広い意味での国連システム全体では6万5000人が働いている。こういった国際機関の職員を国際公務員という。仕事の内容は機関によって異なるが、基本は経済、医療、開発途上国支援などの専門家を中心にした官僚組織。勤務地は世界中に広がっている。各機関の職員の採用は、空席が出たときに随時行われるが、これは国際的な業務について相当なキャリアがある人を対象としたもの。若手職員の採用については、国連事務局が国連職員採用競争試験を行っている。受験資格として「大学卒」「英語かフランス語で仕事をすることが可能」などがあげられているが、実質的には修士以上の学歴と経済、法律などの専門知識、2カ国語以上の外国語の能力が必要といわれている。またこのほかに、外務省が一定期間、各機関の職員として派遣するアソシエート・エキスパートなど派遣制度のようなものもある。
国土地理院で働く,大きく測量と地図の分野がある。測量の分野では、GPS（人工衛星から発信されている電波を受信することで位置を測定するシステム）を利用した電子基準点を全国に整備して観測を行い、地殻変動を監視する。また、数十億光年彼方の準星の電波で1万キロ離れた2点間の距離をミリ単位の誤差で測定する測量技術で、地球規模の測量を行うなど。
国際会議コーディネーター,世界の首脳がそろうような会議からワールドカップ、学会やシンポジウムなど、さまざまな国際的なイベントの、企画から日程や場所の調整、プログラム内容から当日の設営までをセッティングする。海外からの参加者に対応できるレベルの語学力はもちろん必要。主催者側の考えを理解する能力や、どんな事態にも対応できる瞬発力と度胸が求められる。
