title,doc
古地図研究家,古地図とは、科学的な測量や図法が成立する前に作られた地図。絵地図や見取り図、鳥瞰図など多くの種類の地図が残っている。こうした古地図を、歴史あるいは地理、博物学、民俗学、比較文化、美学などさまざまな観点から研究する。古地図研究家は大きく2つのタイプに分かれる。ひとつは大学教授や博物館、美術館の学芸員など、古地図を使って自分の専門を研究する人たち。
古着屋,国内外から古着を買い付け、ボタンの修繕や洗濯、アイロンがけなどを施し、値段をつけ、再度、商品として売る。大手の古着店に入社するという手もあるが、ほとんどはアルバイトなどを雇って数人のスタッフで経営している。買い付けの知識、商品選びのコツなどを学び、独立する方法もある。なかにはフリーマーケットで実際に売ってみて、あまりにもよく売れるため、それで店を開いたという人もいる。
フリースクールで働く,フリースクールとは、本来「自由な学校」という意味であるが、一般的には「不登校や引きこもりなどの学校に行っていない子供たちのための学校」としてとらえられている。また、近年ではその性質から、軽度の発達障害の子供たちのための学校としてもその役割を果たしている。
振付師,ダンスの振りを考え、ダンサーを指導する。バレエからミュージカル、テレビの歌番組、CMまで、ダンスのあるところにはほとんどすべて振付師が存在する。かつてダンサーだった人が多く、現役のダンサーが同時に振付師として活躍する場合もある。何より独創性が求められ、さまざまなジャンルのダンスを吸収する柔軟性も必要。それに人に教えるという立場のため、コミュニケーション能力もいる。
フラワーデザイナー,客の要望や場所に合わせて、花をアレンジする。たとえば、結婚式やパーティーなどの花を考えて飾りつける。専門学校で学んだり、花屋などで修業をして、花屋やホテル、結婚式場や専門会社などに就職して働く人が多い。独立する場合は花屋を営むという形が多いが、その場合はもちろん営業力も必要だ。ほかにフラワーコーディネーター、フラワーアーティストなどさまざまな呼び名があるが、実際は呼び名にこだわる人はあまりいない。何よりもつくるものが美しいかどうかということが、その人の評価基準になる。
フラワーアレンジメントの先生,花の生け方やブーケ作りを生徒に教えたり、店舗やレストランなどに花をディスプレイする。現在日本国内で取得できる資格には、日本フラワーデザイナー協会が設けているフラワーデザイナー（1～3級）や、フラワーデコレーター協会のフラワーデコレーター（1、2級）、中央職業能力開発協会のフラワー装飾技能士（1、2級）などがある。
フラメンコダンサー,フラメンコとは、200年ほど前にスペイン南部のアンダルシア地方で生まれた民族音楽舞踏。歌とギターと踊りで、悲しみや苦しみ、喜びや快楽などを表現するが、フラメンコの原点は差別されて迫害されたジプシーたちの叫びだといわれている。日本にも数多くの愛好家がいるが、フラメンコを踊るだけで生活することは難しく、ほとんどのフラメンコダンサーは教室などを開いて生徒に教えている。特に必要な資格はないが、本場スペインで踊りを学んで来る人が多いようだ。
不動産鑑定士,土地を担保にして金融機関から金を借りるときや、国や都道府県が土地を買収するときに、依頼を受けてその土地の価値を金額で評価する。地元の不動産業者を訪ねて意見を聞いたり、土地の権利関係が記されている登記簿を見たりして、綿密な調査を行い、公平な立場から評価を行うことが求められる。また、不動産の活用方法などについてコンサルティングをすることもある。不動産関係の国家資格では最難関で、3次にわたる試験を突破しなければならない。大学で法律や経済関連の学科を卒業していると有利だが、1次試験から受ければ学歴は関係ない。専門学校に通って勉強する人も多い。合格後は不動産会社や信託銀行、保険会社などに就職する人もいるが、ほとんどは不動産鑑定事務所を設立する。国や県から鑑定業務を依頼されることもあるので、収入が確保しやすいからだ。土地の鑑定は社会的責任の大きい仕事なので、正義感、道徳心の強いことが望ましい。
腹話術師,特殊な発声方法（唇を動かさない腹式発声）で話し、聞き手には話し手とは別の人が話しているように思わせる術が腹話術。多くは人形を手にして、その人形と術者が会話をしてみせる。活動の場は、寄席、劇場、イベント、大道芸、テレビなど。
福祉の公的施設で働く,日常生活を送るうえで困っている人のさまざまな相談に対応し、援助を行う公的施設はその問題に対応して数多くある。たとえば福祉に関する総合的な行政機関である福祉事務所、身体や精神の保健から食事の指導のほか、幅広い分野で地域に密着したサービスを行う保健所・保健センター、身体や精神に障害を抱える人をケアする専門施設や家庭内暴力や経済的な理由で悩む女性を補助する施設などがある。公的な施設で働く職員は公務員なので、ここで働くには公務員試験に合格することが必要となってくる。
福祉に関わる企業で働く,たとえば車椅子やポータブルトイレ、介護ベッドといった介護用品の販売やレンタルを行っている会社がある。こうしたビジネスは福祉・介護サービスが在宅中心になることをうけ、今後の需要が見込まれている。このほかに在宅介護や家事代行のサービスをしている民間企業もある。また寝具メーカーや宅配業界などでも、老人介護に関わるサービスなどが扱われるようになってきている。福祉に関わる企業に就職するには、福祉系の学校で勉強したり、福祉に関わる資格を持っていると有利である。
フォーマルスペシャリスト,結婚式やお葬式などのフォーマルな場で、どんなものを着ればよいのか、どうふるまえばよいのか、冠婚葬祭に関わるアドバイスをする。フォーマルスペシャリストは日本フォーマルウェア協会が認定する資格で、フォーマルアドバイザーとも呼ばれ、現在およそ9000人が活躍している。フォーマルスペシャリストの資格を得るためには、同協会が行っている講習を受け、テストに合格すればよい。
ファッションモデル,ファッションショーをはじめ、CMや雑誌などで服を着こなし、ブランドや雑誌のイメージを表現する。ファッションモデルとして仕事を得るためには、モデルエージェンシーに登録しなければならない。街でスカウトされるのを待つか、オーディションを受ける、あるいはプロフィールをつくってモデルエージェンシーに自分から売り込んでもよい。ただし、ファッションショーのモデルになるためには、身長が170センチ以上あることが第一条件だ。ウォーキングや写真の撮られ方、表情、視線などのモデルとしての基礎は、新人時代にモデルスクールに通って身につける。仕事に必要とされるプロポーションを保つために、常にダイエット生活を続けられるぐらいの強い意志と自己管理力が必要。また体力や忍耐力も要求される。収入は歩合制が多く、知名度が高ければランクが上がり、ギャラもアップする。成功すればスーパーモデルや、女優に転身することもできる。
ファッションデザイナー,主に洋服をデザインする。レディース、メンズ、子供服、ジーンズ、スポーツ、インナーウェアなどに分かれ、企業内デザイナーとオートクチュールデザイナーがいる。1年に4回行われる発表会に向けて、デザイナーはマーチャンダイザーやパタンナーなどのスタッフと念入りに打ち合わせをしながら、準備にあたる。早い場合には1年前からスタートするため、時代を先駆けるセンスや分析力、予測力が必要不可欠だ。また多くのスタッフとの共同作業が多いので、コミュニケーション力も不可欠。もちろん独創性や表現力も重要。メーカーのファッションデザイナーになるためには、大学や専門学校で服飾・デザインを学び、アパレルメーカーなどに就職する。海外の専門学校に留学をしたり、インターネットを利用して販売を行ったり、独自のインディーズブランドを設立する人もいる。ファッションデザイナーに憧れる人は多いが、競争が激しく、就職にあたっても採用は少ないのが現実。デザイナーの登竜門と呼ばれるコンテストで受賞するなど、学生時代から積極的に動くと道が開けることがある。
ピアノ調律師,すべての楽器には調律が必要だ。楽器の保全と管理を含め、その楽器がもっともよい音で鳴るように楽器を調整しなくてはならない。ほとんどの楽器は演奏者自身によって調律されるが、複雑で微妙な構造と機能を持つピアノには、調律を専門にするプロがいて、調律師と呼ばれる。調律師の仕事は、基本的な音程を作る文字通りの「調律」のほかに、もっともよい状態で音を発生させるための整備をする「整調」、さらに演奏者のイメージ通りのデリケートな音色を作る「整音」の3つがある。また最近では、防音について相談に乗ったり、温度・湿度の管理についてもピアノ使用者にアドバイスをすることもある。ピアノメーカーなどに付属する調律師養成機関や、調律科のある音楽大学、専門学校で学ぶか、あるいは高校を出てすぐに修理メンテナンス部門を持つピアノ販売会社などに入り修業する。音に関する感覚が優れていて、音楽が好きで、できれば指が1オクターブの鍵盤に届くことが望ましい。一人前になるには数年かかるが、自分が調律したピアノがすばらしい音を奏でるのは無上の喜びであるらしい。
ビリヤードプレーヤー,今、日本にはトーナメント・プロが350人ほど存在する。大別すると「ポケット」と「キャロム」の2種類のゲームがあり、それぞれ専門のプロがいる。前者はポケットのある台で玉を落とすことを競い、後者はポケットのない台を使い得点を競う。プロになるには資格試験があり、ポケットなら日本プロポケットビリヤード協会、キャロムなら日本プロビリヤード連盟が、筆記と実技の試験を行っている。
美容師,客の希望に応じて、自然で美しい、また流行にあった髪型をつくりだす。ヘアカット、パーマ、スタイリング、カラーリングのほかに、メイクや着付け、ネイルケア、全身美容なども手がける。美容師は国家資格。美容師専門学校（2年間、通信制の場合は3年間）卒業後、理容師美容師試験研修センターが行う国家試験を受験し、合格すると免許証がもらえる。専門学校では基礎的な技術と知識のほか、日本髪の結い方や着物の着付けなどもマスターする。免許取得後は、ヘアサロンや美容室に就職するほか、映画会社や結婚式場、テレビ局などでヘアメイクを担当することもある。経験を積み、指名客をたくさん獲得して、フリーの美容師として活躍する人も。華やかそうだが、修業時代は何カ月もシャンプー担当だったり、閉店後に練習をしたりと、かなり大変。本当にこの仕事が好きでないとまず続かないという。理容師から美容師に転職する人はいるが、その逆はほとんどいないそうだ。また特殊な髪型の専門店もある。たとえば、社交ダンスの選手に需要が高いパーマを専門で行う美容院があるそうだ。
ビデオジャーナリスト,80年代からのビデオテクノロジーの急激な発展により生まれた職業で、小型のビデオカメラを持って街に飛び出し、ニュースの企画、取材から撮影、編集までを一人で行う。組織で取材を行うテレビクルーとは違って個人の自由で大胆な主張を打ち出すことができるのが大きな特徴。独自の取材テープをテレビ局に持ち込んで売り込みをするのが一般的だが、最近ではビデオジャーナリストを育成するための講座も数多く開かれている。
美術・美術監督・デザイナー,美術、美術監督、デザイナーなど、いろいろな呼び方があるが、同じ仕事である。美術監督の下には、美術助手、装飾（たとえばバーのロケセットに必要な酒のボトルを集めたりする仕事）、装飾助手、セットで撮影用の建物などを建てる大道具、小道具（映画の規模によっては助監督が兼ねることが多い）などの係がいる。美術監督は、監督と相談しながら、セットをデザインし、ロケ場所やロケセット（室内でのロケ）を、脚本や演出に即して装飾するためのアイデアを出す。美術監督になるためには、美術大学や映画の専門学校で学び、美術製作会社や映画・映像・CF制作プロダクションなどで助手から始めるのが一般的だが、フリーの美術監督に弟子入りする方法もある。美術監督のアイデアや用意したものは、ダイレクトに映画に映し出される。アメリカでは、美術監督や美術とはいわず、プロダクションデザイナーと呼び、時代考証から始まり、装飾、大道具、小道具、ファッションに至るまで、映画全体の美術プランを作る。
美術デザイナー,コンサート内容に合わせて、舞台監督と相談しながら、ステージセットのデザインをする。ライブコンサートに限らず、オペラ、演劇、ファッションショー、レビュー、テーマパークのイベント、見本市などの会場デザインなど、カバーする仕事の範囲は広い。会場設営会社、舞台美術関係会社に所属する人と、フリーがいる。
美術造形,彫刻家がつくった像の型をとって、溶かしたブロンズ（青銅）を流し込んで作品にする。ひとつの作品をつくるのに、作家のデザインを型に起こす原型、ブロンズを流し込む鋳造など、工程ごとにさまざま職人が携わることもある。美術作品だけではなく、最近は合成樹脂を使って工芸品や機械部品の製作を請け負うこともある。
美術修復家,伝統的な日本画、なかでも仏画や障壁画のような作品は、作品とともにその素材や技法が今日に伝えられ、繰り返し修理が行われてきた。国宝や重要文化財の修復の場合、国宝修理装こう師連盟に加盟している認定技術者が、その作業にあたる。2003年から民間資格を制定、200人ほどが認定を受けている。代々、家業を受け継いだ人がほとんどだ。
美術鑑定士,絵画、書、陶磁器、骨董などの真贋、価値を見分ける。鑑定書を発行することもある。美術館や画廊、古美術商などで働くことになるが、画廊や古美術商などの場合は、価値を時代の相場に合った価格にはじきだす能力も必要になってくる。美術鑑定士として専門的に学ぶ学校はなく、一般的にはほかの鑑定士のもとで修業をし、審美眼を養う場合が多い。
評論家,文学に関しては批評家といわれることもある。代表的なのは「文芸評論家」で、小説や詩を批評したり評論したりして、読者の理解を助けたり文学の質の向上に貢献する。その国が近代化を進めているとき、つまり近代文学が国民に必要とされているときは、評論家は思想やイデオロギーや価値観を作り出すという重要な役目を負うことがある。近代化というのは古いシステムや考え方を、グローバル（世界的・国際的）で新しいものに変えていく過程なので、どうしてもいろいろなところに無理や矛盾が生じる。国民の生活自体はよくなっていくことが多いので、近代化の矛盾は繁栄の陰に隠れがちになり、文学はその隠されたものを物語に織り込んで姿を与えるわけだが、評論家はその作品に込められたテーマを読み解くのである。日本では近代化がほとんど終わり、社会が成熟期に入っているので文学評論は必要ではなくなりつつあるが、それでも文芸評論家と呼ばれる人たちは大勢残っている。ほかに経済評論家、軍事評論家、政治評論家などほとんど無数の種類の評論家がいる。評論家になるには、とりあえずその専門分野の知識が必要だが、その専門分野への強い興味があることが必須の条件となる。
表具師,紙、布、糊を材料に、ふすま、障子、屏風、巻物、掛物などを制作する。繊細な素材を使った複雑な作業であり、高度な技術と経験が要求される。また、貴重な美術品を手がけることも多く、美術に関する幅広い知識も不可欠である。表具師になるには、15、16歳から表具屋に弟子入りをして、7年ほど修業をした後、暖簾分けをしてもらうのが一般的だが、高校、大学を卒業して表具屋に就職する人も多い。
ひな鑑別師,ニワトリを効率よく飼育するために、卵からかえったばかりのヒヨコの性別を見分ける。ヒヨコを手で持った瞬間に生殖器に触れて鑑別するので、手先の敏感な感覚が必要。そのためには早期での教育が欠かせないため、25歳以下で鑑別師養成所に入る。卒業後、孵化場で1～3年間、鑑別研究生として働きながらプロについて学び、農林水産省指導の高等考査の試験を受ける。
筆耕（ひっこう）,依頼者の代理で筆やペンを使って、招待状の宛名や贈り物ののしなどを書く。基本的にすべてが細字。癖がなく、読みやすい字で丁寧に美しく書くことが求められる世界で、専門技術の習得が必要だ。まずは筆耕書道をしっかりと教えてくれる先生を見つけること。技術の習得には少なくとも2年はかかるといわれる。民間で認定試験を行っているところもあるが、資格は必ずしも必要ではない。
秘書,政治家、企業の経営者及び管理職者、各種の専門職者など、高度の管理、専門的な職業につく人を上司とし、その上司がうまく仕事ができるように補佐をする。スケジュールの管理、資料の整理から冠婚葬祭の対応までその仕事は多岐にわたり、素早く臨機応変に物事に対処できることが求められる。また、上司の代理として社外の人と接することも多く、広い社交性と基本的なマナーや言葉遣いは必須である。特別な資格は必要ないが、人柄までもが審査対象となる文部科学省認定の秘書検定があり、毎回多数が検定を受検している。事務の一般職からの登用が多いが、秘書という仕事の専門性はますます評価されてきている。かつて女性秘書は容姿が重要な基準となっていた。現在もその傾向は残っているが、容姿重視から能力重視へとしだいに変化しつつある。だが、同程度の能力なら、整った容姿の人のほうが有利であることには変わりがない。
パチプロ,パチンコやスロットで生計を立てる。フリーもいれば、パチプロの会に所属する人もいる。会に入るには、会費を支払わなければならない。金額はまちまちだが、月に1万円程度。会に入ると、「今どこの店の玉の出がいい」といった情報が入る。なかには、ヤクザとつるんで機械に細工をし、玉が出るようにする「ゴト師」と呼ばれる人もいるが、これは犯罪。
パイロット,航空会社のパイロットになるにはふたつの経路がある。ひとつは大学を卒業後、航空会社が行うパイロットの採用試験に合格し、社内で養成されるというもの。もうひとつは航空大学校に入学し、2年間の訓練を受けた後に航空会社に入社する方法だ。航空大学校を卒業したからといって必ずパイロットとして就職できるという保証はないが、定期採用をしていない会社に入るなど、可能性は広がる。訓練や実務の中でさまざまな資格を取得しなければならないが、旅客機の副操縦士なら事業用操縦士の、機長ならさらに一段階上の定期運送用操縦士の資格が必要になるほか、定期的な身体検査や無線に関する免許、さらに機種ごとに異なる技能証明を受けることなどが必要になってくる。それ以外の事業用としては、小型機、チャーター機や、写真撮影を行う会社などのパイロットがいるが、規模が小さく採用は限られている。また若干だが警察など官公庁でもパイロットの採用がある。やはり事業用操縦士の免許が必要になる。
バーテンダー,カウンターをはさみ、注文に応じて、客の前でカクテルなどの飲み物を作る。いかに客をもてなすかが、バーテンダーの腕の見せどころ。したがって世界の酒やカクテルなどの知識だけでなく、一般教養や客の嗜好を想像する力が必要とされる。バーテンダーになるには、歴史と信用のあるバーで見習として働くのがいい。容姿はあまり関係なく、むしろ人をひきつける魅力が必要とされる。ソムリエや調理師の資格もあるにこしたことはない。バーテンダーは自分で道を切り開いていく職業で、努力すれば自分の店を持つことも可能。馴染み客のツケも多いので、経営の才覚も必要とされる。資格はないが、技能のレベルアップを図るために、日本バーテンダー協会が「全国バーテンダー技能競技大会」を開いている。
板金工,薄い金属板を加工する仕事で、自動車の板金をつくる板金工や、工業板金、屋根や外壁、雨といなどの工事・リフォームを手がける建築板金工などがある。板金工になるために必要な資格や能力は特に定められていない。以前は、学校卒業後、板金工見習として勤めながら、技術や知識を取得していくのが一般的だったが、最近では板金工養成のための職業訓練校や高等技術専門校などに通う場合が多い。たとえば建築板金工の場合、何種類もの工具やはさみを自由自在に使いこなし、思い通りのものを作り上げることに喜びを感じるそうだ。基本的な技術を覚えれば、一生の仕事にできるが、板金店を自営したいと考えるなら、営業や経営などもきちんと学んでおいたほうがいい。関連する資格に建築板金技能士（1、2級）がある。
