title,doc
インペグ屋,INSPECTORの略。レコーディングやライブで、ディレクターやプロデューサーの要望に応じて、スケジュールや報酬の管理を含めて、演奏ミュージシャンを斡旋・コーディネートする。多くのミュージシャンとのネットワークがあることや、レコード会社や原盤制作会社とのコネクションが必要なので、元ミュージシャンや元レコード会社ディレクター、元マネージャーなど、音楽業界出身者がほとんど。
占い師,タロットや星座、手相など、多種多様な道具と知識を用いて、人の運勢やことの吉凶を予想したり予言したりする。プロとアマチュアの境目が曖昧な職業であるが、いくつかの占術協会が存在し、そこに属することが占い師であるひとつの証明となる。収入には幅があり、生計として成り立っているのは、講演会やマスメディアへの露出などを行ったり、企業や個人の客を持つ一部の人だけである。
エンジニア,モノを作る技術者、技師。自動車のエンジンを例にとると、石油エネルギー燃焼の原理に基づいて、いろいろな材料を使い、いろいろな部品を組み合わせ、実験を繰り返して動力源になるエンジンを組み立てる。それだけではない。もし自動車が「エンジンで走る機械」のままでいたら、日本の自動車産業がここまで発展することはなかった。コストや安全性、快適性を求めてさまざまな技術が生み出され、改良されて現在の形になった。さらに、環境問題から、「ガソリン以外の動力で動く自動車」が求められ、最近は、電気や水素をエネルギー源にするエンジン開発の技術を生み出しているのもエンジニア。製造業による「モノづくり」で経済大国になった日本では、1960年代から80年代にかけて、エンジニアの存在は、経済を発達させ、社会を豊かにする原動力だった。機械、化学、金属など、あらゆる分野において、新しい技術から新しい製品がつくり出され、大量生産、大量供給の体制を作り上げてきた。しかし、近年、エンジニアをめぐる環境が変わってきた。大量生産の時代が変化し、市場や客の声を素早く製品に反映させる能力、企業や国という枠を超えて協力し合える能力、ITに関する能力などが必要とされる時代になった。理工系の大学で興味のある技術分野と出会い、技術系の企業や研究機関に就職するのが今でも主流だが、ハイテク企業のなかには、まったく異なる業種から人材を求めるところも出てきている。また、一定の経験を積んだうえで技術士の国家資格をとり、技術コンサルタントとして独立する人も多い。
オーケストラ団員,交響楽団に所属するクラシック演奏家のこと。ただし、交響楽団はそれほど多くの楽団員を募集しているわけではなく、たとえ音楽大学を出ても、交響楽団に入るのは簡単ではない。たとえば東京芸術大学の音楽科の、約400人の卒業生のうち、交響楽団に入るのは数名だといわれている。後は学校の音楽教師になったり、アルバイトをしたり家族の援助を受けながら、演奏家としての活動を続ける。
行政書士,個人や会社が、官公庁に提出しなければならない書類を代行して作成し、手続きをする。企業を設立するにあたって許可を求める書類をつくったり、飲食店の営業開始の申請書をつくる。また、個人同士や個人と会社が、土地や建物の貸し借りを行うとき、お互いの同意のもとに契約書を作成するような仕事もある。司法書士や弁護士などさまざまな分野とリンクする部分があるので、たとえば行政書士兼司法書士といったような開業の仕方をしている人も多い。知名度は高くないが、今後、ますます必要とされる職業で、事業を起こそうとする人とスタートから関わったり、会社の将来を見越し、今後、必要となってくる行政手続きをアドバイスするなどやりがいのある仕事だ。人のためになんとか困難を乗り越えようという気持ちを持てる人でなければ続けられない。国家資格を取得し、行政書士会に所属して開業する。専門学校や通信教育で資格取得を目指す人が多い。
グリーンコーディネーター,観葉植物の知識を持ち、観葉植物を使って、家庭や商業施設、飲食店や小売り店などの店、ホテル、オフィス、イベント会場などを演出するプロフェッショナル。グリーンコーディネーターに必要なものは、観葉植物の種類や栽培・管理方法に関する知識とノウハウをはじめ、インテリアやエクステリアのデザインセンス、植物と照明の関係、エコロジーと環境の知識など。
ゲームプランナー,コンピュータゲームの制作会社で、ゲームの企画立案から完成まで、あらゆる作業に関わる「司令塔」ともいえる重要なポジション。何をおいても必要なのは、面白いゲームを考え出す企画力。そして、それがなぜ面白いのかを会社に伝え、企画を実現させるための表現力もいる。当然、流行をとらえる力、マーケットにおける情報収集力も問われる。ゲームのシナリオづくりに深く関わるため、文章力も少なからず必要である。また、デザイナーやサウンドクリエーターなど、多くのエキスパートとの共同作業を円滑に進めるためのコーディネーターであり、彼らが気持ちよく仕事をするための雑用係でもあるのでコミュニケーション能力も必要とされる。なんといっても最大の魅力は、ゲームが産声をあげてから世に出るまでの一連の流れを目の当たりにできることだ。専門学校も数多くあるが、特に資格はいらない。コンピュータのプログラミングなどができる必要もない。ひとえにセンスが大切な職業である。
コーヒー焙煎の職人,おなじみのコーヒー色の豆は、青白い生豆をロースターにかけて煎ってできたもの。この焙煎（ばいせん）によって、コーヒーの命ともいえる風味と香りが生まれる。焙煎工房の職人は、豆の状態や気候条件などからロースターの温度を決め、焙煎していく。外側も内側も均一になるように煎るのが、職人の技。
サーカス団員,花形は空中ブランコ、人気者はピエロ。団員には誰でもなれるが、一芸に秀でるのは楽ではない。サーカスは各地を移動しながら公演する。その際に、接客係や簡単な照明などのアルバイトを募集する。そのアルバイトのなかで、ステージに立ちたいという人が、公演終了後の夜に練習を重ね、芸を覚えてステージに立っていく。
スーパーカー専門整備士,フェラーリ、ランボールギーニなど、おもにイタリアン・スーパーカーの修理・メンテナンス・車検などを行う。外車整備会社に勤めた後で独立するのが一般的。単に移動するだけではなく、「工芸品」のようなものなので、メンテナンスにもそれなりの気をつかう。自動車ということで基本的に構造は同じだが、フェラーリやランボールギーニと国産車・大量生産車の整備は少し違う。
税理士,税務に関する専門家として、税金を納める必要のある個人や企業から依頼を受けて払うべき税金の計算をし、その書類の作成や手続きを代行したり、税金に関する相談に応じる。税理士になるには、税理士試験に合格するか、弁護士、公認会計士の資格取得者で、日本税理士連合会の税理士名簿に登録することが必要。一般企業や会計事務所に勤務する人もいるが、個人や個人の資格のもとにスタッフを集めて事務所で仕事を受けることが多い。現在、6万7000人ほどの有資格者がおり、国家予算が税徴収によって担われる限り必要とされる職業である。税に関する法律や判例はつねに変化をするものであり、新しい情報や知識を日々収集する必要がある。
ソーシャルワーカー・ケースワーカー,福祉の分野でコーディネーター的な役割をする。身体上・精神上の障害のほか、さまざまな事情で日常生活をおくるのに困難がある人やその家族の相談にのり、助言や指導、援助などをする。勤務先は福祉事務所などの行政機関から企業、病院などさまざまである。公立施設で働く場合は、一般行政職の公務員試験に受かることが必要で、「生活指導員」「相談員」などと呼ばれる。また公立・私立にかかわらず、国家資格である社会福祉士を持っていることが就職の条件になりつつある。この資格を取得するにはさまざまなルートがあるが、福祉系の大学（4年制）で指定科目を勉強し、国家試験を受けるのが一般的。
大道芸人,路上や公園、歩行者天国などで、特別な芸を見せて、観客の投げ銭で収入を得る。戦後直後までは、南京玉すだれや猿回しなどの曲芸、ガマの油売り、バナナのたたき売りなどの口上売りがさかんに行われていたが、近年は路上風俗の規制が強化され、多くの自治体では禁止されている。
著作権エージェントで働く,日本の出版社が外国の書籍の翻訳出版をする場合に、その翻訳権を獲得する必要がある。著作権を持つ外国の著者、出版社と日本の出版社の仲立ちをするのが、著作権エージェント。翻訳書のトビラ裏には、Japanese translation rights arranged through ○○○○Agency（日本語翻訳権は○○○○エージェンシーを通じて獲得）と記載されているが、そのエージェンシーと呼ばれる会社に所属して活動することが多い。
彫刻家,石、木材、ブロンズや鉄などの金属、石膏などで彫刻をつくり、販売する。彫刻家への明確な道筋はないが、経験のある彫刻家に弟子入りしたり、美術大学の彫刻科に入って技術を学ぶ人が多い。彫刻に先駆けて必要になるのは、確かなデッサン力。はじめる時期が早ければ早いほどよく、若いうちから人物や動物、静物などをデッサンして力をつけるとよい。
調香師（ちょうこうし）,花や草、動物の分泌物などから抽出した香りをブレンドし、オリジナルな香りの香水やオーデコロンをつくり出していく。パフューマーとも呼ばれる。調香の専門コースが設けられている美容系の専門学校も数多くある。こうした専門学校や調香のスクールなどで知識と技術を習得し、化粧品メーカーなどに就職するケースがほとんどだ。
彫金師,金属を使って、アクセサリーや小物、建築物の装飾などを作る職人であり、アーティスト。シルバーを使った彫金が最近の主流だが、鏨（たがね）を使って模様を掘り出す日本伝統工芸としての彫金もある。美術・芸術系の専門学校や美大には彫金を専攻するコースがあり、歴史から技術、デザイン、マーケティングなどを総合的に学ぶことができる。あるいは学校ではなく、カルチャーセンターや彫金教室で学んだり、独学することも可能だ。ある程度の技術を身につけたら、彫金工房の採用試験を受けたり、先生のアシスタントとなる、あるいは独立開業する。またそのほかの職場として宝石店や美術館に勤める場合もある。独立を志すなら、コンテストなどに応募し、賞をもらうなど、一般的な評価を得るのがもっとも手っ取り早いだろう。
中学校・高校教師,中学・高校の教師は教科担任制で、教員資格も教科別になっている。そのため、教育学部でなくても、専門科目と教職の単位を修得すれば資格を取ることができる。教師になるには、公立の場合、各都道府県の教員採用試験に合格して採用を待つ。次年度の生徒数や退職教師の数が確定するまで待機が続き、欠員が生じて採用が決まる。少子化が強まるなか、教員採用数は激減しており、競争率は中学で40、50倍、高校で100倍を超すといわれている。30人学級が行われるなど大きな教育改革がないかぎり、厳しい状態が続くと見込まれる。私立の場合は小学校教師と同じく、各校独自の採用が行われる。一部の都県で私学協会の教員適性検査が実施されており、参考にされている。面接では、担当科目への愛着の強さが好感を呼ぶようだ。大学教授や卒業生に推薦や紹介をしてもらう場合も多い。近年は、公立、私立ともに、社会人の対象枠を拡大したり、スポーツや芸術分野で優れた人を採用するなど、個性豊かな資質を持った人を採用する傾向が強まっている。教育現場が荒廃するなかで、生徒との信頼関係を築く豊かな人間性が求められる。
地図編集者,どの範囲を取り込むのか、どの都市を拡大して紹介するのかなどを考えながら、地図の企画、制作を行う。地図は何代にもわたって作りかえられているものが多いため、定番の商品の中身を時代に合わせて変えていくことがほとんどという。実際に現地をくまなく歩いて地図の経年変化を確認する「実踏調査」という仕事もあるが、この場合フリーで仕事をしている個人に外注することがほとんど。
玩具（カルタ、凧、双六）,カルタは平安時代から存在する。もっともこのころのカルタは紙製ではなく、貝でできていた。貴族の遊びであった趣向をこらした貝に歌を詠み添える「貝合わせ」、主に武士に人気があったハマグリの貝を使ってトランプゲームの神経衰弱のように遊ぶ「貝覆い」などである。紙製のカルタが誕生したのは、16世紀に木版印刷の紙製南蛮カルタが広まってから。
ガラス製品,ガラスの製造を含む技術は江戸時代末から明治時代にかけて、ヨーロッパから入ってきた。産業として確立されたのはこのころのことである。ガラス工芸のなかでもっとも古い製品は、蜻蛉玉（とんぼだま）である。これは世界各地で作られていたガラス工芸の基礎ともいえるもので、今に残る最古の蜻蛉玉は、紀元前18世紀ごろのメソポタミアで作られている。日本で本格的なガラスの製造が始まったのは、江戸時代末から明治にかけて、ヨーロッパからさまざまな技法が伝わってきてから。このころから作られているもののなかでは、金剛砂でガラスの表面に彫刻を施す「切子（きりこ）」が有名である。産地：江戸切子（東京都）・大阪蜻蛉玉（大阪府）・肥前びーどろ（佐賀県）・薩摩切子（鹿児島県）など
楽器の先生,初心者からプロ志望者までを対象に、楽器の演奏や音楽理論を教える。ピアノやバイオリンなどの教室、音楽関係の大学や専門学校、楽器店や楽器メーカーのギターやベースやキーボードやパーカッションの教室などで教える。フリーでやっている人も多い。鍵盤楽器、弦楽器、管楽器などは、音楽大学や専門学校などで、専門教育を受けるのが不可欠。特に地方では、卒業大学のランクが生徒集めに影響する。演奏家を目指して活動を続けていた人が、途中から指導者の道を選ぶケースが多い。
楽器製作メーカーで働く,大手の楽器メーカーの場合、楽器製作は完全な分業だ。ピアノの鍵盤なら鍵盤だけを、機械を用いて製作することになる。職人的な世界とはまったく違っている。専門的な知識は就職後に身につけるため、とくに音楽の専門学校を卒業する必要はない。就職試験では専門知識よりも、将来、製作チームをまとめるためのリーダーシップがあるかを見られるようだ。しかし、実際の製作は海外で行っている場合もあり、全体的に採用は減っている。メーカーには企画部門、デザイン部門、設計部門などもあり、デザイン部門は美術大学や専門学校でデザインを学んだ人、コンピュータ時代なので、設計部門は工学部の大学院などで電子系の知識やソフトウェア技術を学んだ人が採用される傾向がある。自分がどの部門に進みたいのか、はっきりさせることが必要だ。また個人でバイオリンやチェロなどを趣味的に製作する人も増えている。
楽器職人,新作の楽器を製作し、そのかたわら修理や調律なども行うのが一般的。バイオリンの場合はオーケストラをメンテナンスの得意先に持つこともある。メインで製作している楽器に近い楽器も作る人もいる（バイオリンとビオラ、ギターとウクレレなど）。職人になるには、工房などに弟子入りするか、専門の学校で学ぶ。弟子入りにはすでにある程度の知識や技術を持っていることが望まれる場合もある。販売本数が多い有名な職人を先生にするほうが、独立してから先生の名前ではくがつくこともあり、後々有利になるといえる。ただし熱意と根気がなければ弟子入りはできない。また海外の学校に留学することもメリットがある。たとえばバイオリンの場合、イタリアのクレモナに専門学校がある。1本の楽器をすべて自分で作る自信がついたら、あるいは先生に一人前として認められて独立する。いずれにせよ技術の習得には時間がかかる。製作した楽器は、小売店や専門誌などに持ち込み、市場を開拓する。出荷本数を多くしたい場合は、日本の楽器販売は小売店や卸しに持ち込む。職人製作の楽器はメーカー製のものに比べ高い値段がつく。13歳はまず演奏家としてチャレンジすることを考えるべきだが、その楽器が好きで好きでたまらないが、演奏家になることを諦める場合には、困難な道ではあるが、ぜひおすすめしたい職業である。
楽器,和楽器、雅楽器と呼ばれる、日本古来からの芸能や祭事に用いられてきた楽器は、中国から伝来したものが多い。たとえば、三味線。これは中国の「三弦」という楽器をルーツとする。この三弦が16世紀半ばに沖縄経由で堺に伝わった。琵琶法師が奏でたため、琵琶の奏法の影響を受け、また本来の材料であるニシキヘビの皮の入手困難などから、長年にわたって改良を重ねた結果、今の三味線にたどりついたという。
ジャーナリスト,広い意味では報道に携わる人全般を指すこともあるし、狭い意味では報道でもマスコミには所属せずフリーランス的な活動をしている人を指すこともある。海外では非常にステイタスの高い職業だが、それは専門性を持っていると認められているから。政治、経済、軍事、科学、スポーツ、映画などとジャンルはさまざまだが、実績と経験がものをいう。
自動車整備士,整備工場やガソリンスタンド、ディーラーなどで、自動車の整備、点検、修理にあたる。整備士になるには、実務経験の後、国の検定試験に合格して資格を取得する方法と、養成施設（国土交通省指定の専門学校や工業高校や各都道府県の講習所）を修了し、民間の認定試験に合格して資格を取得する方法がある。資格は3級、2級、1級があり、2級整備士になると整備工場を営業できる。近年は技術が進み、自動車の構造・装置が複雑化しており、とりわけハイテク化された装置への高度な技術が必要とされている。このような専門知識を持った整備士が不足しているのが現状で、ニーズは高い。また、ハイブリッドカーをはじめ環境重視の社会に適応できる知識も求められ、自動車整備士の役割は変わりつつある。なかでも、これらの最新技術や知識を持つ1級整備士は、技術コンサルタントとして活躍することが期待されている。
自転車整備士,自転車の整備や修理、安全点検を行う。基本的には、販売店が自転車の修理も請け負っており、販売店員であることが多い。基礎として、自転車の構造を理解し、解体から組み立てまですべて1人でこなせる力が必要。子供たちが安全に通学できるよう自転車を点検してアドバイスを送るのも仕事なら、アスリートたちが持ち込むバイクをオーバーホールする、いわばピットの役割もはたす。
CG（Computer Graphics）・CGI（Computer Genarated Image）,たとえば爆発シーンなどで、撮影の後に、炎を大きく見せるように画面をコンピュータ処理する場合など、それをCGショットと呼ぶ。90年代半ばになって、CGとは、コンピュータでシミュレートしたヴァーチャルな映像を指すようになり、CGIと呼ばれるようになった。たとえば『ジュラシック・パーク』では、最初は模型を使ったストップモーション撮影（模型の恐竜を1コマずつ動かして撮影する）が考えられていたが、結局大半のシーンでCGIが使われることになり、複数の恐竜がいっせいに疾走するという、これまでにはあり得なかったシーンができた。CGI技術がさらに進歩して、コストがさらに下がると俳優をヴァーチャルに作り出すことができるという危機感から、ハリウッドの俳優組合の一部にはCGIのひんぱんな使用に反対する動きもある。ただ、たとえば生身の人間では危険すぎてできない演技をするCGスタントなどは、これからさらに増えていくと予想される。CGIの技術の基本は、日本の専門学校でも学ぶことができる。工学的なコンピュータ技術と、絵や彫刻の才能と、映画への深い理解が必要で、CG制作会社に入り、経験を積むのが一般的だが、ハリウッドを目指すのも有効な選択肢である。
CGクリエーター,CG（コンピュータグラフィックス）を使って、画像やイラスト、動画などを作り出す。どこにでもCGが使われている今、CGクリエーターの活躍の場は、映画やテレビ、テレビゲーム、CD-ROM、ウェブサイト、デザイン、イラスト、アニメーションのほか、建築、機械設計、工芸デザイン、科学研究のシミュレーションなど幅広い。大学や専門学校でデザインまたはCGデザインコースを専攻し、卒業後、映像関連や出版関連の制作プロダクション、広告代理店、テレビ局などに勤務するのが一般的。忙しいときには、何日も徹夜作業が続くので、体力と持続力、集中力が必要。CGを使いこなす技術力と同様に、発想力も不可欠だ。またつくりたいものを追求していくと、デザインだけでなくプログラミングまで手がけるようになることもあるとか。関連資格としてはCG検定。3級は初心者レベル、2級は1年ほどの経験者、1級が取れればプロ並みと認められる。
